{
  "version": "2025-11-07-001",
  "default_provider": {
    "provider": "anthropic",
    "model": "sonnet-4.5",
    "temperature": 0.7,
    "max_tokens": 4096
  },
  "lane_overrides": {
    "Code-Impl": {
      "provider": "anthropic",
      "model": "sonnet-4.5",
      "temperature": 0.5,
      "max_tokens": 8192,
      "constraints": {
        "max_cost_per_task_usd": 2.0,
        "max_tokens_per_task": 50000,
        "timeout_seconds": 300
      }
    },
    "Code-API-Design": {
      "provider": "anthropic",
      "model": "sonnet-4.5",
      "temperature": 0.3,
      "max_tokens": 4096,
      "constraints": {
        "max_cost_per_task_usd": 1.0,
        "timeout_seconds": 180
      }
    },
    "Data-Schema": {
      "provider": "local_llama",
      "model": "llama3.1:8b",
      "temperature": 0.2,
      "max_tokens": 2048,
      "constraints": {
        "max_cost_per_task_usd": 0.0,
        "timeout_seconds": 120
      }
    },
    "Vector-Ops": {
      "provider": "local_llama",
      "model": "llama3.1:8b",
      "temperature": 0.0,
      "max_tokens": 1024,
      "constraints": {
        "max_cost_per_task_usd": 0.0,
        "timeout_seconds": 60
      }
    },
    "Narrative": {
      "provider": "anthropic",
      "model": "haiku-3.5",
      "temperature": 0.8,
      "max_tokens": 2048,
      "constraints": {
        "max_cost_per_task_usd": 0.25,
        "timeout_seconds": 90
      }
    }
  },
  "fallback_chain": [
    {
      "provider": "openai",
      "model": "gpt-4o"
    },
    {
      "provider": "local_llama",
      "model": "llama3.1:8b"
    }
  ],
  "cost_optimization": {
    "budget_cap_usd": 100.0,
    "enable_caching": true,
    "prefer_local": false
  }
}
